新闻标题,发表日期,新闻地址,出处,内容
学校举行“学习贯彻习近平总书记考察湖北重要讲话精神 推进落实省第十二次党代会部署”专题宣讲报告会,2022-09-07,https://news.hbut.edu.cn/../info/1002/27571.htm,党委宣传部,9月6日下午，学校在大学生活动中心博学堂举行“学习贯彻习近平总书记考察湖北重要讲话精神推进落实省第十二次党代会部署”专题宣讲报告会。校党委副书记、校长彭育园主持会议并讲话，在家校领导、党委常委出席会议。省委讲师团成员、省委政研室（省委财经办、省委改革办）副主任章新国作专题宣讲报告。章新国以《服务大局勇担使命加快建设全国构建新发展格局先行区》为题，从“加快实现科技自立自强，突破‘卡脖子’关键核心技术”“抓好常态化疫情防控，坚持‘外防输入、内防反弹’总策略和‘动态清零’总方针不动摇”“加强党建引领基层治理，筑牢城乡社区基础”“更好统筹疫情防控和经济社会发展”等四个方面，深入阐明了习近平总书记考察湖北重要讲话的核心要义和精神实质；对省第十二次党代会精神作了深刻解读，系统阐述了党代会报告中关于建设全国构建新发展格局先行区、守住构建新发展格局的安全底线、推动“三高地、两基地”建设、大力发展三大都市圈、实施强县工程、共建共治共享等六个重大问题。彭育园强调，全校上下要把学习贯彻习近平总书记考察湖北重要讲话精神，推进落实省第十二次党代会部署，作为一项重要的政治任务，进一步掀起学习宣传贯彻的热潮。一要强化学习培训，推动讲话精神入脑入心。要通过党委理论中心组、党校团校、“三会一课”、支部主题党日等，组织开展专题讨论、研学交流，确保将精神迅速传达到每一个支部、每一名党员、每一名教职员工。二要深化宣传宣讲，营造喜迎二十大的浓厚氛围。要把学习宣传贯彻作为思想政治教育的重要内容，纳入学生新学期“开学第一课”，融入思想政治理论课教育教学。党员干部要结合“下基层、察民情、解民忧、暖民心”实践活动，面向师生群众开展灵活多样的宣传宣讲，切实形成喜迎党的二十大的浓厚氛围。三要注重统筹协调，推动学习贯彻落实落地。要把学习宣传贯彻与抓好学校各项工作结合起来，统筹发展和安全两件大事，扎实抓好新生开学、70周年校庆、疫情防控、安全稳定等各项工作，为建设全国构建新发展格局先行区贡献湖工大智慧和力量。各单位（部门）主要负责人、机关党群部门副处级干部、各学院党委副书记参加会议。
武汉市公安局出入境管理局局长石伟一行调研我校来华留学教育工作,2022-09-04,https://news.hbut.edu.cn/../info/1002/27560.htm,国际学院,9月2日下午，武汉市公安局出入境管理局局长石伟一行来我校调研来华留学教育工作。校党委副书记、校长彭育园，校党委常委、副校长宋小春出席调研活动。底特律绿色工业学院与国际学院党委书记黄拥军主持座谈会。会上，彭育园对石伟一行来校调研指导表示热烈欢迎，对武汉市公安局出入境管理局长期以来对我校来华留学教育事业的支持表示衷心感谢；彭育园简要介绍了湖北工业大学来华留学教育发展情况和未来规划，希望以此次调研活动为契机进一步推进我校来华留学教育事业高质量发展。国际学院副院长马小红从我校来华留学教育体系、国际学生管理现状、入境及返校方案、友华爱校情怀培养、来华留学事业发展存在的困难、挑战及未来工作的重点等方面作了详细汇报。座谈会上，双方就来华留学教育的政策法规、运行模式及管理规范等问题进行了深入交流和探讨。石伟指出，来华留学教育不仅是国家高等教育事业的重要组成部分，也是国家对外战略的重要一环，来华留学教育管理责任重大，使命光荣。他充分肯定了湖北工业大学来华留学教育所取得的成绩，对湖北工业大学在湖北省来华留学教育管理与服务中提供的“湖工方案”“湖工经验”给予了赞赏。他对我校来华留学教育提出了三点建议，一要紧密结合湖北工业大学学科发展特点，准确凝练湖北工业大学来华留学教育发展特色；二要充分发挥“人防、物防、技防”三位一体安防措施，精准把握来华留学生动态数据，防范未然；三要全面梳理我国涉外法律法规，持续推进来华留学生法制教育常态化、制度化。石伟表示，武汉市公安局出入境管理局将充分发扬“无事不扰，有呼必应”的“店小二”精神，携手湖北工业大学为湖北省对外开放和来华留学教育持续健康快速发展作出应有贡献。宋小春表示，我校历来重视来华留学教育工作，将建成“留学湖工”品牌纳入学校“十四五”规划当中，学校将积极对接武汉市公安局出入境管理局，以全国高等学校来华留学教育质量再认证为契机，以来华留学教育规范化建设为重点，不断推进湖北工业大学来华留学教育提质增效。会后，在宋小春和国际学院相关负责人的陪同下，石伟一行实地考察走访了国际学生公寓，与国际学生亲切交谈，深入了解国际学生生活及学习状况，并对国际学生公寓管理提出了针对性的意见和建议。武汉市公安局出入境管理局办公室、四大队负责人，国际学院负责人及全体国际学生辅导员参加座谈会。
校党委理论学习中心组举行2022年第8次集中学习,2022-09-02,https://news.hbut.edu.cn/../info/1002/27574.htm,党委宣传部,9月2日下午，校党委理论学习中心组围绕习近平总书记重要讲话重要回信重要文章、习近平经济思想、《习近平谈治国理政》第四卷、习近平总书记关于对台工作的重要论述等主题，举行2022年第8次集中学习会。校党委书记刘德富主持学习并讲话，全体校领导、党委常委，校党委理论学习中心组成员参加学习。会上，校党委副书记、校长彭育园领学了习近平总书记在省部级主要领导干部“学习习近平总书记重要讲话精神，迎接党的二十大”专题研讨班上重要讲话精神。校党委副书记蔡光兴领学了2022年第17期《求是》杂志发表的习近平总书记重要文章《新发展阶段贯彻新发展理念必然要求构建新发展格局》及《习近平经济思想学习纲要》第四部分“坚持新发展理念”。校党委副书记胡晓艳领学习近平给“中国好人”李培生胡晓春重要回信精神及《习近平谈治国理政》第四卷第十二部分“推进社会主义文化强国建设”。刘德富作总结讲话。他强调，一要进一步提高政治站位，深入学习领会习近平总书记在省部级主要领导干部专题研讨班上的重要讲话精神，深刻领悟“两个确立”的决定性意义，进一步增强“四个意识”、坚定“四个自信”、做到“两个维护”，不折不扣把党中央决策部署落到实处。二要进一步强化理论武装，迅速掀起学习《习近平谈治国理政》第四卷的热潮。要把《习近平谈治国理政》第四卷作为校院两级党委理论中心组、党校、干部培训、支部主题党日的重要内容，全面系统学、深入思考学、联系实际学，扎实抓好《习近平谈治国理政》第四卷的学习宣传和贯彻。三要进一步树牢新发展理念，推进学校事业高质量发展。要把学习习近平总书记重要文章与《习近平经济思想学习纲要》结合来，深入学习贯彻习近平总书记关于完整准确全面贯彻新发展理念的重要论述，不断提升学校事业高质量发展的水平，以优异的成绩迎接党的二十大胜利召开。
2022年度全校领导干部警示教育暨党风廉政建设宣传教育月动员部署大会召开,2022-09-02,https://news.hbut.edu.cn/../info/1002/27557.htm,纪委、监察处,"根据省委统一部署和学校党委安排，9月1日上午，学校组织召开2022年度全校领导干部警示教育暨党风廉政建设宣传教育月动员部署大会。会议主要任务是贯彻落实省委关于2022年党风廉政建设宣传教育月部署会精神，对全校领导干部开展警示教育。校党委书记刘德富作总结讲话，校党委副书记、校长彭育园主持会议。会上，全校领导干部认真观看了警示教育片《围猎陷阱》，大家深受教育，纷纷表示要以警示教育片中的反面典型为戒，时刻紧绷“廉洁”这根弦。校党委常委、纪委书记秦防修对学校2017年以来查处的违纪违法典型案例进行了通报，并对2022年湖北工业大学党风廉政建设宣传教育月活动进行安排布置。校党委书记刘德富结合今年全省党风廉政建设宣传教育月主题，以领导干部如何做到忠诚、干净、担当作了总结讲话。他指出，全校领导干部要坚定理想信念，筑牢“忠诚”这个为政之基，做到忠于党的信仰、忠于党的宗旨、忠于党的组织；要弘扬自我革命精神，坚守“干净”这个立身之本，做到心存敬畏、戒除贪欲、严于律己；要聚焦干事创业目标任务，强化“担当”这个成事之要，争创一流不懈怠、攻坚克难显担当、创新突破开新局。校党委副书记、校长彭育园主持会议时强调，全体各级党组织要认真推动“宣教月”各项工作的落实，以实实在在的工作成效，确保政治生态、作风效能、党员干部素质形象都有一个明显提升。要以开展好“宣教月”活动为契机,全面认真学习党章党规党纪，从自身做起，模范遵守党纪，提高廉政勤政意识，增强拒腐防变能力。全体校领导、党委常委，校纪委委员，全校副处级以上干部（含“三员”）参加了会议。"
全省第一！湖工大高校智能机器人创意大赛再获突破,2022-09-01,https://news.hbut.edu.cn/../info/1002/27551.htm,机械工程学院,近日，第五届中国高校智能机器人创意大赛全国决赛成绩揭晓。我校共斩获国家级奖项12项，其中特等奖1项，一等奖3项，二等奖4项，三等奖4项。本届赛事中，我校所获国家级奖项数量和质量，在湖北省域高校中排名第一。中国高校智能机器人创意大赛为中国高等教育学会发布的全国普通高校大学生竞赛排行榜上榜赛事，该赛事由中国高等教育学会、教育部工程图学课程教学指导委员会、中国高校智能机器人创意大赛组委会共同主办，浙江大学机器人研究院、中国高等教育学会工程教育专业委员会承办，决赛由浙江省余姚市人民政府承办。受疫情影响，本届赛事于8月27-28日在浙江余姚采用线上线下结合的直播方式进行。大赛以“更好、更快、更强”为主题，竞赛内容为“主题一（创意设计）：家用智能机器人——让生活更美好”“主题二（创意竞技）：——挑战更快”“主题三：智能机器人对抗赛—挑战更强”。历时5个多月，共有426所高校、3921支队伍，经过各赛区选拔赛和全国决赛评审，最终有667项作品获国家级奖项。其中，特等奖12项，一等奖127项，二等奖277项，三等奖251项。本次竞赛从动员、组织到比赛的全过程，得到了学校的关心和支持。近年来，我校高度重视本科生创新实践能力的培养，积极鼓励在校本科生参加高水平学科竞赛。机械工程学院于2019年底成立创新创业中心，服务于院级创新基地建设，为本科生提供创新平台，引领学生投身课外实践活动。近年来，机械工程学院推出学科竞赛指导教师遴选制度，保障指导教师队伍建设；学科竞赛赛事负责人制度，保障各重点赛事竞赛团队的组织和运行。学院在全国大学生机械创新设计大赛、中国大学生工程实践与创新能力大赛（原工训赛）、全国大学生机器人大赛、中国高校智能机器人创意大赛中均取得较好成绩。附：第五届中国高校智能机器人创意大赛获奖名单获奖等级作品名称参赛类别指导老师团队成员特等奖智能泡茶机器人创意设计叶方平罗炜，石旖旎，杜俊龙一等奖梦想之队机器人竞技张铮，许超斌贺文豪，朱世清，段龙祥一等奖智能婴儿车创意设计李博张进，谢昊然，刘贺一等奖“衣”无所忧——家用智能机器人创意设计王莉，杨智勇李飘，刘宛霖，夏宇彪二等奖打的就是精锐机器人竞技李秀红麦凯淇，龚泽楷二等奖力创Rx-仿人双指魔方机器人魔方机器人丁善婷，简泽明黄沛鑫，齐宪，贾磊二等奖智能家用垃圾桶创意设计许超斌，张铮李霖智，孟力，张皓冉二等奖家用智能垃圾桶创意设计叶方平石旖旎，徐岩清，罗炜三等奖全自动清洁壁虎创意设计杨智勇，李秀红袁京鹏，张文议，余宏博三等奖衣柜拯救者创意设计涂细凯，陈水胜卢仕林，林星泽，张显朝三等奖Bottlerecording婴儿辅食喂养机器人创意设计苏旭武徐妍彦，杜霍尔多，关前三等奖漂移过弯机器人竞技肖腾，徐承志王思儒，刘锐，田博元，张紫澳
武汉市科技局党组书记、局长盛继亮一行来我校考察调研,2022-08-30,https://news.hbut.edu.cn/../info/1002/27541.htm,科学技术发展研究院,8月30日下午，武汉市科技局党组书记、局长盛继亮，副局长徐涛一行来我校考察调研科研平台建设和科技成果转化相关工作。校党委副书记、校长彭育园，党委常委、副校长陈自才出席考察调研活动。盛继亮一行先后考察了学校电气大楼、绝缘与检测实验室、太阳能中心等科研场所。考察结束后，双方在行政楼三楼会议室进行了交流座谈。会上，陈自才重点介绍了学校积极服务武汉国家中心城市建设、探索推进职务科技成果赋权改革、做实做强成果转化等方面的工作。电气与电子工程学院院长张晓星汇报了环保智能电工材料及装备中试基地的建设情况。双方围绕科技创新体制机制改革、科研平台建设、科技成果转化、服务武汉经济社会发展等内容进行深入交流。盛继亮对学校热情的接待和长期以来的支持表示感谢，为学校近年来在新能源研究领域取得的成就表示赞赏。他指出，党中央、国务院高度重视区域科技创新中心建设工作，党的十八大以来，习近平总书记五次到湖北考察，三次对加强科技自主创新提出希望。今年4月，科技部、发改委联合批复《武汉具有全国影响力的科技创新中心建设总体规划》，武汉正式成为全国第五个国家级科技创新中心，使命光荣，任务艰巨。他强调，武汉市推进科创中心建设工作，要以高校院所为主体，锚定创建国家科技创新中心和争创东湖综合性国家科学中心目标，明确两个使命、坚持三个着力、深化三个转变，努力提升科研创新能力，将科教人才优势转化为创新发展优势，着力改革、推动聚焦、融合发展。他希望，一是学校中试平台建设要紧紧围绕创新需求和产业需要，积极参与创新联合体建设，加快创新链与产业链深度融合；二是学校在赋权改革试点工作取得良好的阶段性成果基础上，要将成果推而广之，取得示范效应。他最后表示，市科技局支持学校科技创新和科研平台建设，希望双方进一步加强交流与合作，共同推进市校科技创新发展。彭育园代表学校对武汉市科技局领导来校考察调研表示热烈欢迎，对武汉市科技局长期以来对我校科技创新工作的关心和支持表示感谢。他指出，学校长期坚持“立足湖北、服务工业”，坚持内涵特色发展，积极主动作为，准确把握湖北加快建设全国构建新发展格局先行区的重点任务，深度对接湖北“51020”现代产业体系发展战略布局，主动对接武汉市产业转型需求，充分发挥高校人才和科技优势，致力在人才培养、科技创新、服务地方经济社会发展、国内外合作走在前列。他表示，在科研平台建设中，学校进行了论证规划，并启动了筹建工作，希望武汉市科技局进一步加强领导和支持，学校将进一步推进科技体制改革，深度融入和服务武汉经济社会发展，努力为湖北省创新发展、武汉两个中心建设作出更大的贡献。武汉市科技局成果转化处、政策法制处、科技发展促进中心等部门负责人，学校办公室、科学技术发展研究院、电气与电子工程学院等相关部门负责人参加考察调研活动。
省教育厅副厅长周启红一行来校检查指导工作,2022-08-30,https://news.hbut.edu.cn/../info/1002/27537.htm,学校办公室（党办、校办）,8月29日，湖北省教育厅副厅长周启红带队到我校检查和指导新冠肺炎疫情防控及秋季开学工作。校党委副书记、校长彭育园陪同。周启红一行先后来到学校东门、信息技术中心、教五楼、西区食堂、湖北工业大学工程技术学院详细了解疫情防控、开学准备和校园安全稳定等工作情况，听取了彭育园关于学校开学前后疫情防控及秋季学期开学各项准备工作的汇报。周启红对我校疫情防控和开学工作给予充分肯定，并就下一步工作提出要求。一是提高政治站位，认真贯彻落实省委省政府2022年秋季开学与防疫工作会议精神，统筹做好疫情防控和开学准备工作；二是夯实主体责任，精准掌握每一名师生的情况，做好信息筛查和上报工作，确保不漏一人、不留死角；三是严格校园管理，要把好校门关，严格执行健康码、行程码和核酸阴性证明查验等要求，守护广大师生员工生命安全；四是切实做好广大教职员工和学生的安全教育和管理，提升对疫情防控工作的认识，确保全员参与、全力以赴。学校办公室、学生工作部（处）、保卫部（处）、实验室与资产管理处、信息技术中心、湖北工业大学工程技术学院等单位负责人全程参与。
湖工大在第十七届全国大学生智能汽车竞赛中实现历史突破,2022-08-29,https://news.hbut.edu.cn/../info/1002/27531.htm,电气与电子工程学院,8月21日，第十七届全国大学生智能汽车竞赛全国总决赛在南京信息工程大学落下帷幕，湖北工业大学10支代表队参加比赛，共获得一等奖3项、二等奖4项、三等奖3项，其中基础四轮组（全国第八名）、完全模型组（全国第五名）、无线节能组（全国第四名）获得全国一等奖。湖工大获奖成绩在湖北省省属高校排名第一，同时在全国高校中比赛成绩也位居前列，取得历史最好成绩。本次竞赛设置了9个竞速组别以及3个创意组别，来自哈尔滨工业大学、华中科技大学、国防科技大学、武汉大学等全国200余所高校515支队伍参加国赛，湖工大参赛队伍凭借突出实力和精心准备，在全国总决赛中出色发挥，收获国家级奖项十项，其中国家一等奖三项、国家二等奖四项。据悉，全国大学生智能汽车竞赛自2006年开始，至今已经成功举办了17届，是一项旨在加强学生实践、创新能力和培养团队精神的创意性科技竞赛。赛前，参赛学子们在学校以及各学院的关心、支持和指导教师的悉心指导下，通力合作，辛勤付出，做出了大量细致、艰苦的设计制作和赛前准备工作；赛时，参赛学子们更是厚积薄发，表现优异，展现出了湖工学子开拓进取、昂扬向上的精神风貌。本次比赛我校规模不断扩大，参赛学子包含电气学院、机械学院、计算机学院、职业技术师范学院以及底特律学院，同时还举办了智能车校内赛以及华南赛分赛点，为智能车比赛营造了良好的氛围，备受学生认可和喜爱。附：本次比赛获奖项目信息参赛组别获奖等级指导老师参赛学生四轮摄像头组国家一等奖黄周，詹云峰贺楷东，田钧伍，胡佳妮无线充电组国家一等奖黄周，詹云峰杜新晨，雷安，盛振宇完全模型组国家一等奖黄周，詹云峰李欣泽，张海良，梁耀，刘思进，郭轩成平衡信标组国家二等奖丁善婷，陈涛黄晨茂，熊文灏，曹振国四轮电磁组国家二等奖丁善婷，王选择李禹哲，吴若同，余子文群体灭灯组国家二等奖丁善婷，陈涛黄晨茂，熊文灏，曹振国、朱哲民、黄沛鑫航天智慧物流国家二等奖靳华中，叶志伟邓子微，杨博、潘立纬、张霄雨、蔡政洋智慧视觉组国家三等奖黄周，詹云峰廖俊龙，洪绍鹏，刘逸群极速越野组国家三等奖黄周，詹云峰江俊洁，田耕铭，王居正多车编队组国家三等奖黄周，詹云峰张英杰，王集成，罗瑞钰，徐兆熙，丁颖熙
洪山区委常委、宣传部部长陈敏带队来校检查指导秋季开学疫情防控工作,2022-08-26,https://news.hbut.edu.cn/../info/1002/27530.htm,学校办公室（党办、校办）,8月26日，正值学校秋季开学报到日，为进一步夯实疫情防控属地管理责任，更好指导我校做好开学疫情防控工作，洪山区委常委、宣传部部长陈敏带领洪山区相关职能部门来校检查指导秋季开学疫情防控工作，校党委书记刘德富陪同检查。刘德富介绍了学校开学期间门禁管理、学生返校后健康管理、防疫物资储备及核酸检测安排等事宜。他表示，学校一直高度重视疫情防控工作，切实将师生员工的生命安全和身体健康放在第一位，严格按照教育部、省委省政府、省教育厅以及洪山区政府关于疫情防控工作要求，全力做好秋季开学疫情防控和教育教学等各项工作，确保开学安全有序、平稳顺利。陈敏充分肯定了我校秋季开学疫情防控工作。她指出，当前正值各校学生返校高峰期，严峻复杂的疫情形势给学校疫情防控工作带来极大挑战，希望学校密切关注疫情变化，进一步压实工作责任，全面排查、全力排除疫情防控风险点；强化校园管控，做好学生返校前、返校中和返校后的安全教育和信息管理，杜绝风险隐患进入校园；持续优化完善疫情防控方案和应急预案，增强师生防控意识，筑牢校园疫情防控阵地，全力保障师生员工的生命安全和身体健康。学校疫情防控工作领导小组相关负责人随行检查。
