新闻标题,发表日期,新闻地址,出处,内容
全省第一！我校学子获全国英语阅读大赛省赛特等奖第一名,2022-11-07,https://news.hbut.edu.cn/info/1002/27926.htm,外国语学院,2022年“外研社·国才杯”全国英语阅读大赛湖北省决赛于11月5日落下帷幕。我校外国语学院20级创新英语1班的殷赫奕同学以全省第一名的优异成绩斩获特等奖，将与另外两名分别来自湖北大学和武汉大学的特等奖获得者一起代表湖北省参加全国总决赛。“外研社·国才杯”全国英语阅读大赛是由外语教学与研究出版社、教育部人文社科重点研究基地中国外语与教育研究中心联合主办的大型公益赛事。大赛自2018年起连续入选教育部中国高等教育学会发布的“全国高校大学生竞赛榜”。大赛以赛促学、以赛促教、以赛育人的成果获得权威认定。外国语学院大学生创新中心为我校学子参与各类英语类学科竞赛提供良好的智力支持与备赛条件。今年全校600余名学生报名参加了校园阅读选拔赛，初赛人数创历年之最。从初赛脱颖而出的殷赫奕，在创新团队及一对一指导教师的悉心指导下，积极备战，认真钻研，充分展示了我校英语专业学生的语言文化素养和读写思辨能力，也再次体现了我校英语专业创新人才培养模式改革的良好成效。
《追梦》思政课2022年第三讲“筑梦智能时代，书写青年担当”开讲,2022-11-07,https://news.hbut.edu.cn/info/1002/27925.htm,党委宣传部,11月3日下午，湖北工业大学《追梦》思政通识课2022年第三讲“筑梦智能时代，书写青年担当”在学校图书馆报告厅开讲。本次课程由计算机学院承办，计算机学院院长叶志伟教授主讲，湖北工业大学校党委书记刘德富，中国工程院院士倪光南，武汉卓尔信息科技有限公司董事长周显敬，湖北工业大学计算机学院王春枝、张明武、徐志刚、熊才权教授，马克思主义学院副院长石裕东组成授课团队，共同授课。校领导蔡光兴、胡晓艳、王侃、秦防修等到场观摩。刘德富指出，党的二十大报告发出“实现高水平科技自立自强，进入创新型国家前列”的号召，本次课程以“筑梦智能时代，书写青年担当”为主题，激励青年学子为数字经济发展、网络强国建设作出自己的贡献，就是要以实际行动把党的二十大的部署和要求落到实处。湖北工业大学始终坚持“立足湖北、服务工业”，瞄准世界科技前沿和国家重大需求，紧密对接地方经济社会发展战略布局，大力拓展人工智能学科建设，加快核心技术攻关，加速科技成果转化，打造人才集聚高地，奋力为国家和湖北创新驱动发展提供高质量智力支持。刘德富希望湖工大青年学子，胸怀“工业报国、科技强国、创新兴国”的使命担当，坚持执着与创新并举，心怀热爱，钻研“核心算法”；品德与能力并进，心存敬畏，保障“数据安全”；理想与时代同行，心系家国，建设“数字中国”；奋勇拼搏、奋力进取、奋发有为，为更好地服务国家和区域经济社会发展接续奋斗，为实现我国人工智能领域更多“从0到1”的突破贡献力量。熊才权教授讲述了数字经济时代，人工智能算法在工业制造、社会治理和智能决策、智慧物流中的广泛应用，介绍了湖工大人在复杂工业问题建模及NP难组合优化问题方面所做的研究，激励同学们投身算法研究设计与运用，为中国数字经济发展贡献力量。徐志刚教授是国家毒情监测预警体系首席专家，牵头成立了全国第一个地方高校公安大数据研究院，他介绍了团队在云哨、慧眼识毒、值守机器人、平安指数、区块链数据安全、达梦数据库等方面开展的研究创新，讲述了人工智能在公安大数据领域的运用，鼓励同学们积极投身大数据的学习和研究，成为未来的IT才俊，为民生社稷、社会平安稳定作出应有的贡献。王春枝教授围绕“技术自主创新，赋能智慧城市”，讲述了智慧城市建设的目标、任务、特点以及人工智能技术在构建时空大数据平台、助力新型智慧城市建设、服务湖北省重点产业中的应用。张明武教授指出，人工智能是把双刃剑，在用于安全防护提升防御能力的同时，也可以帮助攻击者增强攻击能力，他通过智慧医疗安全电子病历存证、工业互联网安全、人工智能技术生成假人脸及伪视频、视频内容自动审查系统等丰富案例，介绍了湖工大IT人围绕数据与人工智能中的安全问题开展的相关研究。周显敬围绕“信创技术应用确保安全可控”，讲述了智能时代数据安全的问题。他指出，我们要依托于信息技术应用创新、工业控制安全和智慧城市等领域自主核心技术，大力推进我校人工智能和信息技术应用创新产业人才的培养。石裕东结合湖工大“厚德博学、求实创新”校训，讲述了智能时代对社会对人才的需要，鼓励同学们要牢记习近平总书记的殷殷嘱托，坚持勤学、修德、笃行，拥抱智能时代，做担当新青年。倪光南院士为本次课程视频寄语，希望湖北工业大学的青年学子敢做人工智能时代的创新者和信息技术应用创新实践者，把握当下机遇，为社会创新不断注入新活力，将自己的人生理想融入到民族复兴的壮阔画卷中，在更广阔的舞台上实现人生价值。本次课程通过课程导入、主题讲述、互动问答、院士寄语、课程小结等五个环节组成，紧密结合时代发展，层层展开，内容丰富，启迪思考。课程预告在网上挂出后，学生报名踊跃，两分钟内上课名额被抢光。来自计算机学院、电气学院、理学院等学院的近200名学生以及教职工代表参加本次课程学习。课后，计算机学院组织开展的课程网络调研反映，97.8%的学生对本次课程整体评价较高，并提出了进一步增加课程互动、改善课程硬件设备等建设性意见建议。
历史新高！我校学子获7项全国大学生英语竞赛决赛特等奖,2022-11-05,https://news.hbut.edu.cn/info/1002/27919.htm,外国语学院,2022年全国大学生英语竞赛决赛（湖北赛区）于10月底落下帷幕，我校参赛选手再创佳绩，荣获特等奖7项。特等奖获奖人数创历史新高，位列省属高校第一，省域高校第六。19英语3班的严梦和20创新英语1班的殷赫奕获B类特等奖；19会计1班的杨晶、19ET3班的彭俞杰、21ET1班的冷慕怡和21ET2班的李好获C类特等奖；21工设1班的成思获D类特等奖。全国大学生英语竞赛(NECCS)是我国规模较大、参与人数众多的全国性大学生英语综合能力竞赛，在我国大学英语教学改革不断发展和大学生就业日趋严峻的形势下，本赛事受到各高等院校和学子的广泛重视。2022年受疫情影响，该赛事从1月份报名宣传、5月份校级初赛到10月份省级决赛，历时10个多月。我校外国语学院一直高度重视英语学科竞赛工作。在教务处指导与支持下，外院成立大学生创新中心，组建大学英语竞赛指导团队，为学生创设了良好的备赛氛围。在各参赛学院的积极支持下，本次共有2515名学生报名参加初赛，其中16人跻身决赛。在外院创新中心和教学办的精心组织（场地、网络、防疫等）以及指导教师团队的悉心指导下，参赛选手不畏强手，稳定发挥，获得了优异的成绩，充分展示了我校学子的英语水平。此次比赛再次展示了我校英语教学水平和教学改革的成效，增强了我校以赛促学、以赛促教的良好育人氛围。
学校召开工业发酵省部共建协同创新中心和发酵工程教育部重点实验室学术委员会会议,2022-11-04,https://news.hbut.edu.cn/info/1002/27917.htm,科学技术发展研究院,11月2日，学校在行政楼三楼会议室召开工业发酵省部共建协同创新中心和发酵工程教育部重点实验室学术委员会会议，会议由副校长陈自才主持，中国科学院院士邓子新教授、中国工程院院士陈坚教授、中国工程院院士李培武研究员等13名委员和校长彭育园、副校长宋小春出席会议。副校长宋小春宣读了工业发酵省部共建协同创新中心第一届学术委员会和发酵工程教育部重点实验室第三届学术委员会名单。校长彭育园代表学校向与会委员的到来表示热烈欢迎，对学术委员会的成立表示衷心祝贺，并为学术委员会代表颁发聘书。他指出各位委员都是全国微生物和工业发酵领域的专家，对发酵产业的前沿领域和热点问题有着深入地研究，希望实验室和中心以本次会议为契机，按照实验室和中心的规划与发展，充分发挥高校作为科研前沿和人才第一资源重要结合点的作用，结合高校学科建设、科研能力、人才培养等方面的优势与特色，密切跟踪企业发展和需求，提升工业发酵领域的基础研究和协同创新能力，促进工业发酵的研究和产业化发展，为确立我国在发酵领域的科研地位和建设我国的发酵产业提供技术保障和支撑。学术委员会委员听取了实验室和中心主任陈雄教授关于实验室和中心建设情况的汇报，审阅了各PI团队组建和开放基金项目申报材料。学术委员会对实验室和中心建设取得的进展给予充分肯定，认为各团队围绕实验室和中心确立的研究方向、拟解决的关键科学与技术问题，符合中心发展目标定位，具有开展基础研究和协同创新的良好工作基础；各团队成员配备合理，研究计划可行，研究内容、研究进度、预期成果等符合实验室和中心的运行和发展要求。同时，建议围绕我国发酵产业需求，进一步凝炼科学问题，聚焦核心技术，加强共性关键技术的基础研究和协同创新。科学技术发展研究院、生物工程与食品学院、工业发酵省部共建协同创新中心、发酵工程教育部重点实验室相关负责人参加了会议。
学校为80、90周岁寿星老人集体祝寿,2022-11-03,https://news.hbut.edu.cn/info/1002/27913.htm,离退休工作处,11月3日，学校在教职工活动中心为我校今年满80、90周岁的寿星老人集体祝寿。校党委副书记、校长彭育园，校党委副书记蔡光兴出席活动。彭育园代表学校向全体寿星致祝寿辞。校“两协”负责人、寿星子女和青年学生代表，以及离退休工作处全体人员共同为寿星老人祝寿。集体祝寿活动由离退休工作处处长王皑主持。彭育园代表学校，用自创的藏头诗“生活幸福比蜜甜，日子过得赛神仙，快意人生体康健，乐享天伦惹人羡！”祝福全体老寿星，并向全校离退休教职工致以亲切问候和美好祝愿——生活之树常绿，生命之水长流！彭育园强调，各位老领导、老前辈是湖工大历史的创造者、贡献者，虽然离开了工作岗位数十年，但学校永远不会忘记大家几十年如一日的奋斗坚守，永远不会忘记大家为学校建设倾注的心血，永远不会忘记大家为学校发展做出的贡献。彭育园表示，学校将一如既往地高度重视离退休工作，用心用情用力办实事、做好事、解难事，更好的满足老同志对美好生活的向往，努力让离退休老同志共享改革发展成果、安享幸福晚年。真诚期待老同志们一如既往地关心、支持学校工作，讲好湖工大故事，为学校“双一流”建设和改革发展建言献策。彭育园致辞中还回顾了前不久学校隆重举办建校七十周年庆典大会，全面总结七十年来的办学成绩和经验；以及迈入新时代，学校践行为党育人、为国育才使命，向着“绿色工业学科特色鲜明的高水平工业大学”目标不断奋进的办学业绩和蓝图愿景。蔡光兴宣读了寿星老人名单，祝福寿星和离退休教职工快乐永驻、幸福安康！活动中，寿星代表、原湖北工学院副院长何世秀，代表老同志对学校无微不至的照顾与辛苦付出表示由衷感谢，并倡导老同志们始终保持积极阳光心态，继续关心支持学校发展，在关心下一代成长中发挥特有优势作用，积极展现湖工大老年人的风采！校“两协”副会长王美寅代表全体离退休教职工祝福老寿星们福寿绵长，长乐永康！寿星子女代表、校工会金烨分享了90岁父亲金之铭的人生故事，并为全体老寿星送上真挚祝福！校团委学生艺术团学生代表以歌舞、戏曲、朗诵、民乐演奏等形式表达了对寿星老人的祝福与敬重。据悉，学校今年有15名离退休教职工满90周岁，48名退休教职工满80周岁。集体祝寿活动在合影留念后圆满结束。
校党委理论学习中心组专题学习党的二十大精神,2022-10-26,https://news.hbut.edu.cn/info/1002/27883.htm,党委宣传部,"10月25日下午，校党委理论学习中心组围绕党的二十大精神主题，举行2022年第10次集体学习。校党委书记刘德富主持会议并讲话，全体校领导、党委常委出席会议，校党委理论学习中心组成员参加学习。刘德富领学了习近平总书记代表第十九届中央委员会向二十大作的报告，传达了习近平总书记在参加广西代表团讨论时、在党的二十大闭幕会上、在二十届中共中央政治局常委同中外记者见面时的重要讲话精神，传达了关于十九届中央委员会报告的决议、关于十九届中央纪律检查委员会工作报告的决议、关于《中国共产党章程（修正案）》的决议，传达了湖北省传达学习党的二十大精神会议有关精神。校党委常委、领导班子成员结合学习贯彻党的二十大精神，进行交流发言。校党委副书记、校长彭育园表示，要深刻理解二十大关于教育的新思想、新战略、新要求。党的二十大报告指出，实施科教兴国战略，强化现代化建设人才支撑，更加突出科教兴国在社会主义现代化建设全局中的重要地位，更加突出教育、科技和人才在社会主义现代化建设中的战略支撑作用，更加突出教育在科教兴国中的基础性、战略性地位，具有重大意义。建设社会主义现代化强国，实现经济社会高质量发展，对教育改革发展提出新要求，我们必须清醒地认识到，我国距世界教育强国还有很大的差距，必须加快发展，奋起直追，不懈努力。校党委副书记蔡光兴表示，深入学习贯彻二十大精神，要深入学习新党章，对照修改内容掌握新要求，更加自觉地学习党章、遵守党章、贯彻党章、维护党章，在思想上政治上行动上同以习近平同志为核心的党中央保持高度一致；要常抓不懈党史学习教育，坚定历史自信，增强历史主动，敢于斗争、敢于胜利，埋头苦干、锐意进取；要深刻体会二十大对教育工作的战略部署，不断推进高等教育高质量发展，为加快教育强国、科技强国和人才强国提质赋能、贡献力量。校党委副书记胡晓艳表示，学习贯彻二十大精神，要胸怀国之大者，勇担教育强国建设使命任务，以更强的政治自觉和历史主动推进高水平工业大学建设；要坚守为党育人、为国育才初心使命，不断提升大学生思想政治工作水平，努力为国家培养有理想、敢担当、能吃苦、肯奋斗的新时代好青年；要扎实开展党的二十大精神学习宣传贯彻工作，坚持不懈用习近平新时代中国特色社会主义思想武装头脑、统一思想，凝聚广大师生团结奋斗力量。校党委常委、副校长龚发云表示，二十大报告围绕“实施科教兴国战略,强化现代化建设人才支撑”作出一系列重要部署，是全面建成社会主义现代化强国、全面推进中华民族伟大复兴的钥匙。教育、科技、人才在高校既相互联系又相互影响，正确处理好这三者之间的关系，实现教育、科技、人才的突破，是学校工作的核心与重点。要积极应对百年未有之大变局，顺应新一轮科技革命、产业变革和国际竞争，全面落实立德树人根本任务，建设高质量教育体系，大力发展素质教育，完善科技创新体系，加快建设世界重要人才中心。校党委常委、副校长王侃表示，党的二十大报告创造性地给出了中国式现代化的新方案，提出了中国式现代化九个方面的本质要求。中国式现代化，是中国共产党领导的社会主义现代化，是立足中国实际，既符合中国国情，又蕴含着智慧与自信，让人可期可及。中国式现代化道路是开放的、可学可鉴的，给了世界上那些既希望加快发展、又希望保持自身独立性的国家和民族提供了全新选择和深刻启示。校党委常委、纪委书记秦防修表示，党的二十大报告对“坚定不移全面从严治党，深入推进新时代党的建设新的伟大工程”作出重大战略部署。一体推进“不敢腐、不能腐、不想腐”是习近平总书记在长期实践中总结提出的原创性理论，深刻揭示了标本兼治、系统施治的反腐败基本规律，丰富了党的自我革命战略思想，开辟了从严管党治党新境界。校党委常委、副校长宋小春表示，深入贯彻党的二十大精神，要快速推进学校一流学科建设质效提升。要聚焦战略需求，持续深化“135+”学科发展战略，通过“轻工+”“+轻工”，进一步强化一流学科群发展模式；要统筹资源配置，创新一流学科群领军人才引育机制，探索大项目、大成果有组织的培育机制；要强化绩效评估，健全完善“双一流”建设实施、动态监测及评估机制，实现轻工学科高质量发展；要加强组织领导，健全“双一流”建设管理工作体制机制，确保“双一流”目标如期实现。校党委常委、副校长陈自才表示，二十大报告中关于“完善科技创新体系”“加快实施创新驱动发展战略”“增强自主创新能力”的论述，对学校科技工作具有十分重要的指导意义。深入学习领会二十大精神，要准确把握内涵实质和根本要求，全面审视学校科技工作现状，查找短板和不足，进一步激发科技工作者投身科技创新、为实现高水平科技自立自强而奋斗的热情，努力在学科建设、基础研究、人才培养、平台提升、成果转化和服务社会等方面，积极作为，奋发有为，切实为一流大学创建添砖加瓦，夯实基础。校党委常委、党委组织部部长桂丽表示，党的二十大报告中关于党的建设的重要论述和重大部署，对于深入推进新时代党的建设新的伟大工程具有重大意义。准确把握推进新时代党的建设新的伟大工程的全面部署，必须坚定不移推进全面从严治党，必须以政治建设为统领，必须建设忠诚干净担当的高素质专业化干部队伍。刘德富作总结讲话。他指出，党的二十大是在全党全国各族人民迈上全面建设社会主义现代化国家新征程、向第二个百年奋斗目标进军的关键时刻召开的一次十分重要的大会。习近平总书记在大会上作的报告，站在战略和全局高度，全面总结过去五年和新时代十年的伟大变革，科学谋划未来五年乃至更长时期党和国家事业发展的目标任务和大政方针，提出了一系列新思路、新战略、新举措、新要求，是指导全面建设社会主义现代化国家、向第二个百年奋斗目标进军的纲领性文件，为我们做好当前和今后一个时期的各项工作进一步指明方向、提供根本遵循。我们要紧紧围绕习近平总书记在二十大上的报告这个重点，对标“五个牢牢把握”的要求，把学习宣传贯彻党的二十大精神作为当前和今后一个时期的头等大事和首要政治任务，教育和引导党员干部、全体师生切实把思想和行动统一到党的二十大精神上来，把智慧和力量凝聚到党的二十大确定的各项目标任务上来，深刻领悟“两个确立”的决定性意义，增强“四个意识”，坚定“四个自信”，做到“两个维护”，迅速掀起学习宣传贯彻二十大精神的热潮。一要在深学细悟上下功夫。要结合实际学习，把学习贯彻党的二十大精神与贯彻落实习近平总书记关于湖北工作的重要讲话和指示批示精神结合起来，与贯彻落实省第十二次党代会工作部署结合起来，与学校“十四五”规划结合起来。要坚持原原本本学，坚持读原著、学原文、悟原理。要坚持示范带动学，领导干部要先学一步、学深一层。要坚持常态长效学，开展互动式、体验式学习，拓展学习效果，确保入脑入心。二要在宣传宣讲上下功夫。要多层次开展学习宣传活动，确保把党的二十大精神宣传到教学科研一线、宣传到师生心里。要积极邀请权威专家、省委宣讲团成员来校开展专题辅导报告，切实把党的二十大精神讲清楚、讲明白、讲到位。要组建校院两级党委宣讲团，开展广泛宣讲，推动党的二十大精神进课堂、进教材、进师生头脑。要强化思想政治引领，用党的二十大精神凝心聚魂，推动学校党员干部、全体师生想在一起、干在一起。三要在落地见效上下功夫。要深入践行新发展理念，将学习宣传贯彻党的二十大精神与学校实际相结合，围绕高质量发展主题，深入开展调研，不断优化学校“十四五”发展规划，科学谋划各方面工作。要围绕年度目标，抓好学校各项工作，确保全面完成本年度目标任务。要进一步聚焦一流学科建设，科学谋划“大学者、大学科、大平台、大成果、大项目”，采取超常规举措抓好落实，实现突破。要进一步思考学校未来发展目标和创新举措，积极谋划明年的工作目标、工作思路和工作任务。要坚持“动态清零”不动摇，落实“疫情要防住、安全稳定底线要守住”总要求，做好疫情防控工作，确保师生生命财产安全，守住校园安全底线。"
