新闻标题,发表日期,新闻地址,出处,内容
我校举办中国防水企业家高级研修班,2022-07-11,https://news.hbut.edu.cn/../info/1002/27355.htm,土建学院,7月9日上午，中国防水行业“黄埔一期”之“中国防水企业家高级研修班”在湖北工业大学开班。此次研修班由深圳市防水行业协会和湖北工业大学联合举办，来自全国防水行业的56名企业负责人及高管以线上和线下的方式接受为期六天32学时的培训。湖北工业大学党委书记刘德富，中国建筑防水协会驻会副会长羡永彪，中国建筑防水协会副会长、深圳市防水行业协会会长瞿培华在开班仪式上致辞。瞿培华对湖北工业大学筹办本次培训班付出的努力表示衷心地感谢。他表示，中国建筑防水协会与湖北工业大学合作由来已久，早在2005年，在中国建筑防水协会、深圳市防水协会和行业企业的支持下，学校开办了全国第一个防水材料与工程本科专业方向，而后相继合作开办了第一个建筑与土木工程领域工程硕士班，为中国建筑防水行业的发展培养了大批优秀人才。羡永彪代表中国建筑防水协会对本次高研班的顺利开班表示热烈地祝贺。他表示，建筑防水工程质量与百姓民生息息相关，优质的建筑防水人才供给将有助于提高防水行业整体水平的提升。此次由深圳市防水行业协会与湖北工业大学联合举办的“中国防水企业家高级研修班”，是中国防水行业的“黄埔一期”，未来还将继续举办，为防水企业家学习、交流、研讨提供一个重要平台。刘德富在开班仪式上致辞。他表示，近年来学校主动对接国家和地方绿色工业发展和传统工业绿色化的战略需求，持续深入实施以绿色工业为主导的“135+”学科发展战略，着力培养具有国际视野和绿色理念、创新创业及实践能力强的高素质应用型人才。自防水材料与工程本科班开办以来，向社会输送了近千名优质人才，此次高研班的开办是学校与行业、企业的进一步深度交融，也希望在科学研究、学生就业、实习实训等方面能够持续深度合作。土木建筑与环境学院党委书记唐良辉介绍了高研班管理架构及学员须知，着重强调了疫情防控工作要求。土木建筑与环境学院副院长黄艳雁介绍了为此次高研班量身定制的八门课程以及授课师资相关情况。高研班教师代表江波、学员代表湖北宇虹防水工程有限公司总经理袁露芸分别作为教师代表和学员代表发言。最后，刘德富、羡永彪、瞿培华向高研班班长夏晔、副班长袁露芸、副书记周立学授“中国防水企业家高级研修班”班旗。湖北工业大学研究生院、土木建筑与环境学院、继续教育学院、校医院主要负责人，土建学院教师、研究生、本科生代表和高研班全体学员参加了开班典礼。
【文化校庆】国家艺术基金“长江经济带文旅产业品牌策划与设计青年人才培养项目”作品展在翟雅阁开展,2022-07-09,https://news.hbut.edu.cn/../info/1002/27356.htm,艺术设计学院,7月9日上午，国家艺术基金艺术人才培养资助项目《长江经济带文旅产业品牌策划与设计青年人才培养》作品展在武汉设计之都客厅——翟雅阁博物馆开展。湖北工业大学党委常委、副校长龚发云、相关职能部门及学院领导出席了开幕式。武汉市城建局、武汉设计产业促进中心、湖北美术出版社、长江文艺出版社、长江日报、武汉市集邮协会、武汉市邮政分公司、湖北省包装联合会设计委员会、武汉九一创作协会等单位领导，武汉大学、中国地质大学（武汉）、湖北美术学院、华中农业大学、中南民族大学、武汉工程大学、江汉大学、长江大学、湖北经济学院、武汉工商学院、武汉软件工程职业学院等兄弟院校的专家受邀莅临现场。开幕式由项目负责人、艺术设计学院院长汪涛教授和学员代表何家辉主持。龚发云首先代表学校，对莅临结题仪式的领导、专家表示热烈地欢迎和感谢，对15位学员创作出优秀的作品表示祝贺。他指出，长江是中华民族母亲河，历史源远流长。长江的发展不仅关系到长江流域的经济、文化发展，也关系到整个中华民族的伟大复兴。《长江经济带文旅产业品牌策划与设计青年人才培养》项目以人才培养为契机，以长江经济带为蓝图，对区域和国家的文旅产业和经济发展重大的意义和价值。湖北工业大学作为一所立足于服务区域经济发展的省属高校，在国家艺术基金项目的申报和实施工作方面一直起着引领示范作用。艺术设计学院充分发挥“湖工大设计”品牌优势，多次获批国家艺术基金，希望继续加大对外合作、交流、借鉴，作出更大的贡献。武汉市城建局勘察设计与科技处处长、一级调研员孙明先生致辞，他代表武汉设计之都建设的主管部门，对本次展览开幕表示热烈祝贺，同时也感谢学院团队多次参加武汉设计双年展的工作。本次项目结合长江经济带设计了6大主题、15组作品，探索了中国传统文化范式和新表达，充分体现了年轻设计师无尽的创造力。愿青年设计师继续努力，以更多更新的设计，为进一步提升中华文化影响力、向世界呈现绚烂多彩中华文明做出贡献。中国地质大学（文化）艺术与传媒学院院长桂宇辉教授致辞，他指出，湖北工业大学艺术设计学院是湖北设计领域的品牌，办学40余年来，培养了大量的优秀设计人才。此次国家艺术基金项目在有百年历史的翟雅阁举办展览，感慨良多：一是，要在最好的自然资源和人文资源基础上，用智力打造出受年轻人喜欢的、富有强大生命力的文化品牌；二是要加强湖北武汉设计兄弟院校间的合作，携手齐心、再创辉煌。随后，汪涛与湖北省长江生态保护基金会项目经理李响博士进行了项目成果授权仪式，将“长江造字计划”和“图说长江经济带”两个项目作品无偿授权给湖北省长江生态保护基金会永久使用，希望发挥艺术设计的力量助力长江大保护生态公益事业发展。武汉设计之都促进中心秘书长蔡辉先生宣布开幕。据悉，此次国家艺术基金人才培养项目开班仪式于2021年12月14日在湖北工业大学举行，来自全国各艺术设计高校、文创机构和企业的15名学员进行了为期30天的集中培训。集中培训后，组织学员进行了采风调研、作品设计和制作。本次结业作品展围绕中国的母亲河——“长江”，分设生态保护、工业遗产、非遗传承、遗址保护、乡村振兴、红色文旅6大主题，集中展示学员历时6个月创作完成的作品。活动现场同时展出了以长江生态和可持续设计为主题的2022年艺术设计学院研究生作品。此次展览将持续到7月17日。
湖北能源集团股份有限公司来校调研交流,2022-07-08,https://news.hbut.edu.cn/../info/1002/27343.htm,学校办公室（党办、校办）,7月8日上午，湖北能源集团股份有限公司党委委员、副总经理姜德政一行带队来校调研交流工作，校党委书记刘德富出席调研活动。姜德政一行在刘德富的陪同下，重点考察了湖北省河湖生态修复与藻类利用重点实验室等科研教学场所，详细了解了学校在河湖生态修复与藻类利用方面的学科及科研情况。随后，双方召开交流座谈会，就开展合作进行了深度交流。座谈会上，刘德富对湖北能源集团股份有限公司来校调研表示热烈欢迎，对长期以来的关心和支持表示衷心感谢，并从学校的基本情况、发展规划和重要发展举措等方面进行了简要介绍。他表示，湖北工业大学长期坚持立足湖北、服务工业的办学定位，积极融入国家创新驱动发展战略和地方经济社会发展，主动对接国家和地方绿色工业发展和传统工业绿色化的战略需求，在高素质应用型人才培养、绿色工业学科建设、社会服务等方面形成一定的特色和优势，衷心希望双方以此次调研交流为契机，进一步加强在学科建设和科技成果转化等方面深度务实的合作。姜德政对学校的热情接待和长久以来的支持及帮助表示感谢，并对湖北能源集团股份有限公司的历史沿革、业务布局、发展战略和服务面向进行了简要介绍。他表示，近年来湖北能源集团股份有限公司主动服务国家“双碳”目标，在履行主责主业的同时，积极履行社会责任，带动地方经济社会发展，现已成长为湖北省重要的能源安全保障平台。湖北工业大学在推动绿色工业学科建设方面具有深厚的积累和较大的优势，湖北能源集团股份有限公司愿意加强同湖北工业大学的深度合作，共谱互利共赢高质量发展新篇章。湖北能源集团股份有限公司生产技术与营销部、宜城发电公司，以及我校科学技术发展研究院、生物工程与食品学院、土木建筑与环境学院等相关单位负责人参加活动。
学校召开暑期假前干部大会,2022-07-07,https://news.hbut.edu.cn/../info/1002/27337.htm,学校办公室（党办、校办）,7月6日下午，学校召开暑期假前干部大会。校党委书记刘德富主持会议并讲话，校党委副书记、校长彭育园总结部署安排工作。全体在家校领导班子成员出席会议。彭育园结合上级关于高等教育高质量发展的有关精神和学校2022年工作要点，总结回顾了上半年工作，安排部署下阶段重点工作任务。他指出，学校坚持走内涵式特色化发展之路，工作要点得到逐项落实：“双万计划”走在前列；研究生教育体制机制更加完善；教师职业能力提升计划扎实推进；科技创新工程稳步实施；成果转化和科技服务地方能力不断增强；国际交流与合作驶入快车道；校地政企合作渐入佳境；保障服务体系更加完善；资源配置机制更加规范高效；智慧校园建设稳步推进；疫情防控更为精准科学等。对如何做好下半年工作，他强调，一是要端正认识。必须清醒认识到，学校的改革发展离上级要求还有较大差距，离2022年目标任务的全面落实还有一定差距。二是要积极谋划。统筹抓好常态化疫情防控和事业发展各项工作，要用好用足假期宝贵时间，做好下半年工作计划，确保各项工作积极推进。三是突出重点。对“全国大众创业、万众创新活动周”湖北省主会场活动、中非合作论坛、中国“互联网+”大学生创新创业大赛湖北省复赛筹备等重要工作提了具体要求。刘德富围绕下半年工作，对与会干部提了三点要求：一是要开拓创新，及时跟进学习。各单位（部门）负责人要利用假期时间强化理论知识学习，创新工作方式方法，确保各项工作稳步推进。二是要抓住关键，完成一批标志性成果。要围绕假期重点工作，争取在重大奖项申报、人才引进等方面取得重要成果，推动学校高质量内涵式发展。三是认真总结，推动各项工作顺利开展。要总结反思上半年工作，对于还存在的短板和难点问题要积极提升，做好申博和学科评议、基建维修、双创人才培养和校庆筹备等重点工作。学校各单位（部门）主要负责人参加了会议。
再传捷报 我校入选首批国家级创新创业学院建设单位,2022-09-09,https://news.hbut.edu.cn/../info/1002/27586.htm,教务处,近日，教育部办公厅公布国家级创新创业学院（100所高校）、国家级创新创业教育实践基地建设名单（100所高校），我校成功入选首批国家级创新创业学院建设单位。自申报工作启动以来，学校领导高度重视、综合统筹、悉心指导。创新创业学院、教务处、招就处通力合作，认真总结学校创新创业教育工作经验，提炼学校创新创业人才培养成果，研讨双创学院建设目标和建设任务。此次入选，是对我校创新创业教育工作与人才培养质量的再次高度肯定。近年来，学校高度重视创新创业教育工作，将深化创新创业教育改革纳入学校整体发展战略，从育人理念、质量标准、教学模式、课程建设等方面深入推进教育教学改革，取得显著成效，2016年学校入选“全国首批深化创新创业教育改革示范高校”、2018年入选教育部“全国创新创业典型经验高校50强”、2018年入选“中国双创典型示范高校”、2020年“绿盟众创空间”成功备案国家级众创空间、2021年创新创业教育教研室获批为湖北省优秀基层教学组织。下一步，我校将以国家级创新创业学院建设为契机，持续深化创新创业教育改革。加强双创平台建设，早日建成6万平米的双创中心，整合校级创新创业教育和实践平台，形成学校创新创业教育和学生创新创业的良好生态环境。完善创新创业教学体系与模式。深入推进创新创业教育与专业教育、思政教育紧密结合；探索并构建“创意激发、创新创业训练、创新创业实践、创业孵化”全链条创新创业教育新模式。强化创新创业实践，深入推进学科竞赛“六个一”工程，以赛促学、以赛促创、以赛促教；实施短学期实践2.0版，深入开展大学生创新创业训练计划，推进项目式实践教学改革。强化双创指导教师队伍建设。实施创新创业导师培育工程，提升双创专职教师的能力水平，引进一批高水平企业兼职双创导师，在专业教师中培养一批创新创业指导教师，建设创业导师数据库，实现创业导师教学资源共享。
湖北省生态环境执法实战实训基地在我校揭牌,2022-09-09,https://news.hbut.edu.cn/../info/1002/27582.htm,土建学院,9月8日，湖北省生态环境厅在我校隆重举行“湖北省生态环境执法实战实训基地”签约揭牌仪式。湖北省生态环境厅副厅长万丽华、二级巡视员陈同亮和省环境执法监督局局长杨龙文等领导出席仪式。活动由湖北省生态环境厅二级巡视员陈同亮主持。校党委书记刘德富代表学校对湖北省生态环境执法实战实训基地落成表示祝贺，对湖北省生态环境厅长期以来给予学校的信任和支持表示衷心感谢。他指出，学校近年来紧紧围绕国家和地方经济社会发展需求，大力实施以绿色工业为主导的“135+”学科发展战略，坚持以培养创新创业和实践能力强的高素质应用型人才为目标，积极推进“721”人才培养模式改革，社会影响力不断扩大。他表示学校将充分发挥相关学科专业优势，按照执法实战实训的培训要求进一步完善现场教学、实战、实训的基础场地建设，进一步完善培训相关执法装备配置，强化培训师资配备与考核，发挥我校工业门类专业齐全优势，为打造湖北省生态环境保护铁军中的主力军，推进湖北省生态文明建设提供强有力的科技支撑。万丽华副厅长代表省生态环境厅感谢我校领导对生态环境执法实战实训基地建设的高度重视，并对基地建设提出两点意见。第一个方面，要充分认识建设实战实训基地的重要性：建设实战实训基地，是落实综合执法改革，加强执法队伍综合监管能力建设的重要要求；建设实战实训基地，是破解执法难点痛点，助力深入打好污染防治攻坚战的重要支撑；建设实战实训基地，是补齐实战能力短板，打造生态环境执法铁军的重要抓手。第二个方面，要充分发挥好实战实训基地的重要作用：一是要大力提高环保执法人员实战技能；二是要大力发挥环保专家智库力量；三是要大力开展执法新技术、新设备、新方法和信息化管理研究；四是要大力推进执法重难点问题技术攻关。会上，陈自才副校长宣读成立湖北工业大学生态环境执法实战实训基地建设领导小组及成员名单。陈同亮巡视员和陈自才副校长代表双方签署共建框架协议。万丽华副厅长和刘德富书记共同为湖北省生态环境执法实战实训基地揭牌。湖北省环境执法监督局全体人员、学校基地建设领导小组成员、土木建筑与环境学院负责人和相关教师参加了揭牌仪式。
人福医药集团股份公司来校调研,2022-09-09,https://news.hbut.edu.cn/../info/1002/27579.htm,学校办公室（党办、校办）,9月7日下午，人福医药集团股份公司党委书记、董事长李杰，副总裁、总工程师李莉娥一行来校调研科技创新有关工作，校党委书记刘德富，校党委常委、副校长陈自才陪同调研。李杰和李莉娥一行实地考察调研了学校发酵工程教育部重点实验室，并同我校教授代表就医药研究方面的工作情况进行了深入的交流探讨。随后，双方召开了座谈交流会。座谈会上，刘德富代表学校对人福医药集团各位领导专家来校考察调研表示热烈欢迎，对长期以来关心和支持学校的发展表示衷心感谢，并重点对学校人才培养、学科特色、科技创新和成果转化方面的情况进行了介绍。他介绍，学校近年来高度重视生物工程及医药领域的建设与发展，立足大健康产业发展和现实问题，主动调整优化相关学科布局，加快推进人才培养、科学研究和成果转化，形成了一定的特色和优势。他表示，人福医药集团作为湖北乃至全国医药工业重要企业，具有深厚的市场、人才、资源和技术积累，衷心期望双方能够以此次考察调研为契机，积极探索校企合作新模式，加强在资源、人才、平台等方面的共建共享共用，以实现双方优势互补、共同快速成长，在医药的人才培养和科学研究领域结出更多硕果、做出更大贡献。李杰对学校热情周到的接待表示衷心感谢，对学校在医药研究领域取得的成绩表示敬佩。他从公司发展历程、主责主业、产业布局、优势特色等方面对人福医药集团进行了介绍。他指出，通过此次考察调研，深感湖北工业大学在医药研究领域基础好、成长快、成果多，与人福医药集团许多业务领域和发展方向契合度高，双方具有非常大的合作空间。他表示，人福医药集团非常愿意加强同湖北工业大学在人才培养、科学研究、成果转化等方面的合作，愿意助力湖北工业大学将更多更好的科研成果实现转化、推广、应用，双方携手共进，共同为湖北乃至中国的医药发展贡献力量。人福医药集团医药研究院、战略发展部和我校科学技术发展研究院、生物工程与食品学院、材料与化学工程学院、艺术设计学院等相关单位负责人参加考察调研活动。
中国工程院院士李培武、省科协正厅长级干部陈兴荣一行来校调研,2022-09-07,https://news.hbut.edu.cn/../info/1002/27572.htm,学校办公室（党办、校办）,9月5日下午，中国工程院院士、中国农业科学院油料作物研究所研究员、博士生导师李培武和省科协正厅长级干部陈兴荣一行来校考察调研学科建设和科研工作，校党委书记刘德富，校党委常委、副校长陈自才陪同调研。李培武和陈兴荣一行先后实地考察了学校发酵工程教育部重点实验室、酿酒新技术及装备示范中试基地等教学科研场所，详细了解学校在学科建设、科技创新和成果转化等方面情况。座谈会上，刘德富代表学校对李培武院士和陈兴荣主席一行来校调研表示热烈欢迎，对长期以来关心和支持学校的发展表示衷心感谢，并重点对学校学科建设、科学研究、产教融合及发展规划进行了介绍。他表示，学校近年来紧紧围绕国家和地方经济社会发展需求，以提升服务“绿色工业”发展能力为主线，围绕“节能、减排、降耗、提质、增效”主题，主动调整优化学校学科布局，并立足绿色工业科技重大理论和现实问题开展科学研究和人才培养工作，在学科建设、科学研究和人才培养方面形成了一定的特色。他表示，在国家和社会对高水平学科建设和高质量科学研究的需求日益迫切的重要时期，高素质人才队伍对学科建设和科学研究的支撑和引领作用尤为重要，衷心希望李培武院士和上级领导能进一步加强对我校人才队伍建设、学科建设和科学研究等方面工作的关心和支持，帮助学校提升办学质量和增强服务社会能力。陈兴荣指出，通过此次实地参观考察，对湖北工业大学的印象耳目一新、令人振奋，对学校近年来办学治校取得的成绩感到欣慰和赞叹，对学校领导和教职员工充满高等教育情怀表示敬佩。他表示，作为联系科技工作者的桥梁和纽带，省科协有义务和责任帮助高校加强学科建设和科学研究工作，自己会竭尽所能帮助和支持学校不断向好向优发展，努力让学校为湖北科技工作作出新的更大贡献。李培武对学校热情周到的接待表示由衷感谢。他指出，此次来到湖北工业大学考察调研，印象深刻、收获颇丰，学校长期以来坚持“立足湖北、服务工业”的办学定位，坚持不断优化顶层设计，以更好服务社会经济发展，彰显了学校的办学特色和使命担当，学校在学科建设、科学研究和人才培养方面取得的成绩让其对湖北工业大学产生了颠覆性认识。他强调，在新的高等教育形势下，学校若要取得更大办学成绩，必须坚持面向世界科技前沿、面向经济主战场、面向国家重大需求、面向人民生命健康，努力产生标志性成果，打造办学优势和特色。他表示，经过深度的考察调研，对学校的发展前景充满信心，非常愿意加强与学校的深入交流合作，衷心希望学校能在人才培养和科技创新两座高地上不断取得新成绩，为国家和地方经济社会发展不断作出新贡献。科学技术发展研究院、人事处、机械工程学院、生物工程与食品学院、农机工程研究设计院相关单位负责人参加考察调研活动。
