新闻标题,发表日期,新闻地址,出处,内容
中共湖北工业大学委员会三届五次全体（扩大）会议暨中层干部培训会召开,2022-08-26,https://news.hbut.edu.cn/../info/1002/27524.htm,学校办公室（党办、校办）,8月23日至24日，中共湖北工业大学委员会三届五次全体（扩大）会议暨中层干部培训会召开。此次会议旨在认真学习贯彻落实习近平总书记考察湖北重要讲话精神，深入学习贯彻落实省第十二次党代会精神，努力在湖北建设全国构建新发展格局先行区中展现新担当。校党委书记刘德富以《勇担使命开新局改革创新谋发展在湖北建设全国构建新发展格局先行区中展现新担当》为题向党委全委会报告工作。工作报告全面总结回顾了学校2022年上半年工作，安排部署下半年主要工作，要求坚决贯彻落实党中央的决策部署，统筹推进新冠肺炎疫情防控与“双一流”建设，持续推进学校高质量发展，以优异成绩向党的二十大和学校七十周年校庆献礼。会上，校党委副书记、校长彭育园作了《以提质为导向以增效为目标奋力推动学校改革发展迈出新的步伐》的专题工作报告。报告从“高质量发展、数字化、质效提升”三个关键词入手展开论述，要求贯彻落实学校第三次党代会确定的“四个四”发展思路，坚持一张蓝图干到底，进一步统一思想，努力完成各项工作任务，做好下半年的相关工作。彭育园指出，学校改革发展精准把握当前宏观政策趋势是关键，准确把握努力方向是重点，要在科技创新、双一流建设、双碳行动等方面积极行动，找准学校所处历史方位，抢抓发展机遇，推动学校高质量发展。数字化在学校改革发展中有着重要作用，要坚持以教育信息化促进教育现代化，贯彻落实教育数字化战略行动，促进学校创新发展的理念变革、思想变革、方法变革、实践变革，站在更高的起点谋划新时代智慧校园建设思路和途径，努力形成湖工大经验。彭育园强调，全校上下要紧扣学校2022年主要目标提出的“质效提升”总要求，在党建工作、双一流建设、人才培养、科技创新、师资队伍建设、合作发展、管理服务和70周年校庆等工作上再接再厉，再创佳绩。校党委副书记蔡光兴，校党委副书记胡晓艳，校党委常委、副校长龚发云，校党委常委、副校长王侃，校党委常委、副校长宋小春，校党委常委、副校长陈自才分别以《高质量建设一流教师队伍》《落实立德树人根本任务全面提升学生思想政治工作质效努力为高水平工业大学建设做出更大贡献》《人才培养的几点看法》《统筹安全发展推动更高质量的平安校园建设》《提高我校专业学位研究生教育质量的思考》《对学校科研工作的初步认识与思考》等为主题，进行工作指导与交流。会上，校党委书记刘德富作了题为《大学育人生态系统构建及优化-以湖北工业大学为例》的专题辅导报告。结合学校实际，围绕大学育人生态系统构建展开了深入阐释。刘德富指出，在信息时代的背景下，高等教育的供求关系、国家需求、国际竞争环境、对象、资源条件都发生了很大的变化。大学育人生态系统发生了根本性的转变，在新的育人生态系统下，学校的办学定位、人才培养目标、人才培养途径都是教职员工需要认真思考的问题。刘德富强调，全校上下要紧密围绕学校第三次党代会确立的建设绿色工业学科特色鲜明的高水平工业大学目标，努力构建高水平绿色工业学科专业体系，立足湖北、服务工业、面向基层，培养具有国际视野、绿色理念、创新创业和实践能力强的高素质应用型人才。刘德富指出，人才培养永远是学校的中心工作，要以特色与优势学科专业构建工程、人才强校工程、人才培养质量工程、科技创新工程和文化建设工程等五项工程为重点，全面推进育人生态系统建设，严格贯彻落实立德树人的根本任务。会议围绕校党委工作报告、校长专题工作报告进行了分组讨论。校党委常委会听取了各组召集人讨论情况汇报。大家一致认为，报告紧扣新时代的特征和上级工作要求，主题鲜明、内容丰富、思路清晰、举措有力，提出的阶段性工作着力点和突破点比较准确，提出的新学期工作任务针对性较强，有利于进一步统一思想、凝聚共识、促进发展。与会党委委员对党委工作报告进行表决并全票通过。电气与电子工程学院院长张晓星、生物工程与食品学院院长唐景峰、土木建筑与环境学院院长肖衡林、教务处处长王德发、国际交流与合作处处长龙艳、研究生院院长贺行洋，分别以《3个“破解”助力学院高质量发展》《以大健康引领学院突破促进学科交叉融合》《聚焦“十四五”为“强院”赋能》《形势与使命：百强之路的思考》《以国际合作平台和项目建设为抓手助力学校高质量可持续发展》《大力推进研究生教育改革稳步提升培养质量》为主题，进行交流发言。校党委书记刘德富作总结讲话。首先，刘德富传达了湖北省2022年秋季学期开学疫情防控和安全稳定工作会议精神，要求学校各单位部门要贯彻落实会议精神，严格落实疫情防控和安全稳定的相关要求，认真履职尽责，及时防范化解各类风险。刘德富对开学季疫情防控、党建工作、教学准备、70周年校庆等重点工作进行了强调。随后，刘德富向全体中层干部提了三点要求：一是建立终身学习的理念和培养终身学习的能力。要结合自身的工作实际，多途径多渠道主动开展学习，科学谋划相关工作。二是增强责任感，紧盯目标，勇争第一。要建立“不进就是退，慢进也是退”的工作理念和标准，紧盯目标，全方位对比，全力提高各项工作成效。三是正风肃纪，营造风清气正的良好干事创业氛围。全面从严治党一刻也不能放松，要深化巡视整改成果，加强党风廉政建设，一体推进“不敢腐、不能腐、不想腐”的体制机制制度体系走深走实，营造风清气正的良好干事创业氛围。全体校领导、党委常委，校党委委员、校纪委委员，校属各单位、机关各部门主要负责人，全体组织员、督导员、纪检员，全体副处级干部参加了会议。
湖工大在第十届全国大学生机械创新设计大赛中实现历史突破,2022-08-26,https://news.hbut.edu.cn/../info/1002/27523.htm,机械工程学院,8月21至23日，第十届全国大学生机械创新设计大赛全国决赛在深圳技术大学顺利举行。我校机械工程学院共有3支队伍跻身全国赛，获国家一等奖两项，二等奖一项。其中，由陈云健、徐璋琪、陈琰、毛正午、王锐同学设计制作的“海洋互花米草治理旋耕船”，李霖智、孟力、史德隆、杨少楚、王壮怀同学设计制作的“爪抱式仿生尺蠖”分别在全国决赛中斩获国家一等奖；杨裕鑫、张子煜、李昊天、李纪元、陈徐阳同学设计制作的“轻功水黾漂-仿生水黾”获国家二等奖。我校所获国家级奖项数量和质量，在湖北省属高校中排名第一，实现历史突破。本次大赛以“自然•和谐”为主题，竞赛内容为“设计与制作模仿自然界动物的运动形态、功能特点的仿生机械产品（简称仿生机械）”和“用于修复自然生态的生态修复机械装置（简称生态修复机械）”。来自全国30个省（直辖市、自治区）的704所高校共5972件作品报名参赛，经过各赛区选拔赛和全国决赛第一阶段评审，最终有200件作品入围全国决赛。受疫情影响，本届比赛采用线上结合直播的方式进行，大赛共计产生一等奖162项，二等奖266项，三等奖125项。“海洋互花米草治理旋耕船”竞赛团队“爪抱式仿生尺蠖”竞赛团队据悉，全国大学生机械创新设计大赛是经教育部高等教育司批准成立大赛组织委员会，是由教育部高等教育司发文举办的全国理工科重要课外竞赛活动，每两年举办一次，是国内最具影响力和历史最悠久的大学生竞赛项目之一。大赛以其“实物参赛、机电结合、系统训练、创新应用、科技创业”的突出特色，获得了全国高校机械类和工程类等专业广大师生高度赞誉和积极响应。该赛事已成为国内最具影响力、培养学生工程实践能力和综合素质效果显著的大学生竞赛项目。附：第十届全国大学生机械创新设计大赛获奖名单获奖等级作品名称作品类别指导老师团队成员国家一等奖海洋互花米草治理旋耕船生态修复机械游颖陈云健，徐璋琪，陈琰，毛正午，王锐国家一等奖爪抱式仿生尺蠖仿生机械孙金风、许超斌李霖智，孟力，史德隆，杨少楚，王壮怀国家二等奖“轻功水黾漂”仿生水黾仿生机械张铮、许超斌杨裕鑫，张子煜，李昊天，李纪元，陈徐阳
湖工大在全国高校大学生艺术类竞赛指数中排名前十,2022-08-23,https://news.hbut.edu.cn/../info/1002/27532.htm,数字艺术产业学院,8月21日，“高校创新人才培养能力提升研讨会”在杭州举行，高校教师教学发展研究国家级虚拟教研室联合浙江大学、湖北工业大学首次发布“全国普通高校大学生艺术类竞赛指数”，榜单覆盖1098所本科院校。其中，湖北工业大学在该指数排序中位居全国前十。该竞赛指数排行榜对分数段列排行50%以内的院校进行排序，并从A+到C-依次进行划分。湖北工业大学以369项竞赛获奖数据取得A+等级，排序全国前2%，位列全国前十。会上，湖北工业大学数字艺术学院院长饶鉴教授代表中国高等教育学会“高校竞赛评估与管理体系研究”专家工作组，对艺术类竞赛指数进行分析发布。饶鉴介绍，虚拟教研室相关工作组以开设艺术学理论类、音乐与舞蹈学类、戏剧与影视学类、美术学类、设计学类等艺术类相关专业的普通高校为主要对象，采集了25项高校艺术类相关竞赛近三年共1155683条竞赛数据，从获奖贡献、参赛贡献两个维度构建了评估模型，研发了艺术类竞赛指数。饶鉴表示，数据显示理工类院校在艺术类竞赛中的表现优于其他类型院校，倾向于“数字+艺术”的学科竞赛获奖数据稳定上升，艺术类竞赛正呈现学科多元融合、学科赛事多元交叉发展的趋势，以此助推社会经济创新发展。
【书记校长访企拓岗促就业】校党委书记刘德富率队赴国网湖北省电力有限公司走访调研,2022-08-11,https://news.hbut.edu.cn/../info/1002/27496.htm,学校办公室（党办、校办）,8月11日上午，校党委书记刘德富率队赴国网湖北省电力有限公司开展“访企拓岗促就业”专项行动，双方围绕人才培养、科研合作等工作召开了交流座谈会，共同探讨校企产学研合作。校党委常委、副校长陈自才出席调研活动，国网湖北省电力有限公司董事、总经理、党委副书记吴英姿，副总经理、党委委员彭天海接待了刘德富一行。座谈会上，吴英姿对刘德富一行的走访调研表示热烈欢迎，并从公司的发展历程、核心业务、战略规划等方面介绍了国网湖北省电力有限公司的相关情况。她表示，在公司战高温、保供电、竭尽全力促发展的重要时刻，湖北工业大学各位领导不顾高温酷暑天气到公司调研，充分体现了学校对公司的关心关注和对推进校企合作工作的高度重视，国网湖北省电力有限公司非常愿意加强同湖北工业大学在人才培养、联合科研等方面的交流合作，希望双方以此次走访调研为契机，进一步夯实合作基础、凝聚合作共识，共同探索人才培养和产学研用新模式。刘德富对国网湖北省电力有限公司的接待表示衷心感谢，并对学校学科发展战略、人才培养模式、科技创新举措、校企合作成绩及招生就业状况等方面情况进行了介绍。他表示，学校长期坚持“立足湖北、服务工业”，紧密对接地方经济社会发展和企业行业需求，努力开展科技创新和人才培养工作，通过大力实施“135+”学科发展战略、“721”人才培养模式改革、“绿色工业”科技引领计划等重要举措，着力提升学校办学实力和服务社会能力。作为湖北省电力领域的龙头企业，国网湖北省电力有限公司在资源积累、标准制定、电力系统开发、服务社会等方面具有显著优势，真诚期望双方能够进一步深化在科技创新、人才培养、资源共建共享等方面的交流合作，努力发挥双方优势，共同推动校企合作发展再上新台阶。座谈会后，刘德富一行在国网湖北省电力有限公司电力科学研究院院长、党委副书记梅欣的带领下，实地参观考察了电科院新型电力系统实验室、生产科研大数据平台、电科院企业文化馆等场所，并同电科院领导就校企双方资源共建共享、人才共育共用、联合科研攻关等方面工作进行了深度的交流探讨。国网湖北省电力有限公司电力科学研究院、办公室、人力资源部、科技部，以及我校学校办公室、科学技术发展研究院、招生与就业指导处、社会资源处、电气与电子工程学院等单位相关负责人参加了走访调研活动。
学校2022年引智工作再创佳绩,2022-08-10,https://news.hbut.edu.cn/../info/1002/27495.htm,国际交流与合作处,近日，据科技部、省科技厅、省教育厅、省科协相关文件，学校2022年各级各类引智平台与项目获准立项数、获批金额总数位居省属高校首位。学校2017年获批的科技部/教育部“细胞调控与分子药物学科创新引智基地”（国家级“111基地”）顺利通过第一个五年建设期评估，滚动进入第二个五年建设期；2021年获批的湖北省“新材料与绿色制造引智创新示范基地”考核优秀，获得资助；2022年新申报的湖北省“智能科学与技术引智创新示范基地”获准立项，该基地是学校获得认定的第四个省级学科引智创新示范基地。同时，学校还获批2项国家级外国专家项目：“伴侣蛋白调控的细胞蛋白质折叠在孤独症中的作用与机制研究”、“抗量子攻击区块链隐私保护技术研究”；获批1项湖北省外国专家项目：“氧化还原应激反应能力在传染病早期预警与监测中的研究与应用”；获批1项湖北省世界著名科学家来鄂讲学武汉论坛及6项来鄂讲学计划项目；学校“2022中非工业创新与技术转移合作论坛”获批立项湖北省科学技术协会海智计划资助项目。据介绍，引智工作是是学校国际交流合作“十四五”发展规划六大行动计划的重要依托之一。
湖工大校友张瑞获WTT突尼斯站国乒女单、女双双料冠军,2022-08-07,https://news.hbut.edu.cn/../info/1002/27477.htm,党委宣传部,北京时间8月6日，2022年世界乒乓球职业大联盟（WTT）常规挑战赛突尼斯站比赛落下帷幕，中国队拿到两项冠军。湖北小将、湖北工业大学校友张瑞以4比3险胜日本的张本美和夺得女单冠军，张瑞/蒯曼在德比战赢球夺得女双冠军。张瑞出生于湖北武汉，中国国家乒乓球队队员，2022年从湖北工业大学毕业。她是目前国乒比较少见的横拍反手生胶运动员，打法与伊藤美诚接近，担任主力队员的陪练。WTT突尼斯站女单赛场，她一路走来战胜了邵洁妮、平野美宇和范思琦，半决赛以4比1战胜日本选手长崎美柚。决赛迎来日本14岁小将张本美和的挑战，双方打到决胜局，张瑞以总比分4比3夺得女单冠军。同时，她也将凭借WTT常规挑战赛突尼斯站女单冠军400积分，世界排名大幅上升。女双决赛是中国德比战，张瑞/蒯曼最终以3比1击败石洵瑶/何卓佳，夺得冠军。这既是张瑞在本站比赛第二冠，也是国乒第二冠。近年来，张瑞先后获2015年全国大学生锦标赛单打冠军，2018年国际乒联卡塔尔公开赛女单冠军，2019年世界大学生运动会团体冠军、女单亚军、女双亚军。2022年，她还先后获得wtt阿曼常规赛双打冠军、wtt卡塔尔常规赛单打亚军。
校党委书记刘德富率队赴咸宁市嘉鱼县考察调研,2022-08-03,https://news.hbut.edu.cn/../info/1002/27453.htm,学校办公室（党办、校办）,8月3日上午，校党委书记刘德富率队赴咸宁市嘉鱼县考察推进校地合作有关事宜，嘉鱼县县委书记王永、县委常委、组织部长黄鹏、副县长杨富佳等县领导接待了刘德富一行。在王永的带领下，刘德富一行先后实地走访调研了嘉鱼县蓝野科技有限公司、官桥镇两湖虾稻基地和现代农业产业园，详细考察了嘉鱼县相关产业发展状况。随后，双方召开座谈交流会。座谈会上，王永对刘德富一行到嘉考察交流表示热烈欢迎，并从嘉鱼县地理区位、产业布局、未来规划等方面介绍了嘉鱼县基本情况和发展优势。他表示，嘉鱼县地处幕阜山脉与江汉平原结合部，紧邻武汉和长江，具有得天独厚的自然资源和发展优势，真诚期望进一步加强同湖北工业大学深入务实的合作，嘉鱼县也将从政策扶持、环境建设、资源配置等方面加强对双方合作的支持力度，以实际行动让双方合作结出累累硕果。刘德富对嘉鱼县委县政府热情周到的接待和长期以来对学校的关心支持表示衷心感谢。他指出，在嘉鱼县委县政府的大力支持下，近年来学校相关科研团队以葛仙米的培育养殖、产品推广等为试点，在嘉鱼县开展了务实有效的科学研究和成果转化工作，并取得了一定的成绩。他表示，湖北工业大学愿意加强同嘉鱼县更广阔务实的合作交流，双方要以此次考察调研为契机，立足长远、做好规划，建立更加稳定紧密的交流沟通机制，努力早日推动校地合作再上新台阶。学校科学技术发展研究院、生物工程与食品学院等相关单位负责人参加了考察调研。
【书记校长访企拓岗促就业】校党委书记刘德富赴安琪酵母股份有限公司走访调研,2022-08-02,https://news.hbut.edu.cn/../info/1002/27449.htm,社会资源处,7月31日，校党委书记刘德富率队赴宜昌安琪酵母股份有限公司开展“访企拓岗促就业”专项行动。校企双方围绕校企合作、人才培养等工作进行了深入交流并为省级研究生工作站揭牌。安琪集团创立于1986年，前身是食用酵母科研基地，2000年在上交所上市。公司总资产167.5亿元，净资产93.9亿元。经过多年稳健发展，公司业务规模不断扩大，酵母及深加工产品已广泛应用于烘焙与发酵面食、食品调味、酿造及生物能源、人类营养健康、动植物、微生物营养等领域。在宜昌、广西柳州等国内多地及埃及贝尼斯韦夫省、俄罗斯利佩茨克州等国外城市建有16个工厂，酵母类产品总产能35万吨，在国内市场占比55%，在全球占比15%，产销规模已居全球酵母行业第二。2010年，公司就与我校签订了战略合作协议，12年来，双方在人才培养、科技合作、平台共建等方面开展了深入的产学研合作，取得了丰硕的成果。公司员工中有我校校友近200人，其中，中高层干部20余人，内设机构负责人40余人，众多校友已经成长为公司业务发展的中坚力量。座谈会上，公司总经理肖明华对刘德富一行表示热烈欢迎。他介绍了企业的发展状况，公司与我校在人才培养、科技合作、平台共建等方面的合作情况，以及下一步计划与我校进行深入合作的事项。招生与就业指导处副处长侯国强介绍了教育部“访企拓岗”政策，社会资源处副处长石刚介绍了学校70周年校庆筹备工作情况，生物工程与食品学院党委书记杨光介绍了学院的基本情况。随后，双方围绕校企合作的具体方面进行了深入交流。刘德富指出，此次走访安琪集团的目的主要有三个：一是“访企拓岗”，促进学校就业工作；二是深入交流，寻找合作契机；三是看望合作伙伴和校友，邀请公司领导和校友参加校庆活动。他详细介绍了学校生源结构、学科建设、人才培养及科技创新等方面的情况。他强调，要建立校企长效合作机制，从平台共建共享、人才共引共用、人才联合培养、项目共研共担、成果联合报奖等五个方面深入推进校企合作。随后，刘德富与肖明华共同为“湖北工业大学-安琪酵母股份有限公司省级研究生工作站”揭牌。在宜昌访企期间，刘德富还走访了宜昌校友会，看望了部分校友代表，并在宜昌校友会主要负责人的陪同下走访了部分校友企业。学校招生与就业指导处、社会资源处、电气与电子工程学院、生物工程与食品学院相关负责人参加了走访调研活动。
【学术校庆】2022年全国仪器类专业教师能力建设研讨会在武汉召开,2022-07-31,https://news.hbut.edu.cn/../info/1002/27451.htm,机械工程学院,7月29日，由教育部高等学校仪器类专业教学指导委员会（以下简称“仪器教指委”）主办，湖北工业大学承办的2022全国仪器类专业教师能力建设研讨会在武汉召开。湖北工业大学党委副书记、校长彭育园教授出席大会开幕式并致辞，对会议的召开表示热烈祝贺。本次大会采用线上线下结合会议形式，来自华中科技大学、天津大学、湖北工业大学、哈尔滨工业大学、武汉大学、东南大学等18所高校，以及中国仪器仪表学会的仪器类专业教指委委员及相关专家共32人参加了线下现场会议，同时近100余代表参加了线上会议。本次研讨会旨在加强全国仪器类专业教师能力建设经验交流，分享国内外仪器类专业建设的最新成果及培养良好教师队伍的创新思想。会议由仪器教指委副主任委员钟毓宁教授主持，中国工程院院士、华中科技大学校长、仪器教指委副主任委员尤政院士和教指委主任委员曾周末教授围绕仪器类专业建设与教师能力分别做了精彩发言。教指委委员宋爱国教授、许贤泽教授，以及中国仪器仪表学会人才发展部曹征主任（线上）、湖北工业大学副校长宋小春教授、湖北汽车工业学院机械工程学院院长王生怀教授分别做了主题报告。主题报告之后与会代表根据各单位基础与特色进行了交流发言。本次会议是湖北工业大学七十年校庆到来之际由机械工程学院举行的系列活动之一，校学科办、研究生院负责人参加了开幕式。
